13:36:04.941784 80:ce:b9:71:e2:37 > ff:ff:ff:ff:ff:ff, 802.3, length 46: LLC, dsap Null (0x00) Individual, ssap Null (0x00) Command, ctrl 0x81f5: Supervisory, Receiver not Ready, rcv seq 64, Flags [Poll], length 46
13:36:04.941794 80:ce:b9:71:e2:37 > ff:ff:ff:ff:ff:ff, 802.3, length 46: LLC, dsap Null (0x00) Individual, ssap Null (0x00) Command, ctrl 0x81f5: Supervisory, Receiver not Ready, rcv seq 64, Flags [Poll], length 46
13:36:04.943573 80:ce:b9:71:e2:37 > ff:ff:ff:ff:ff:ff, 802.3, length 46: LLC, dsap Null (0x00) Individual, ssap Null (0x00) Command, ctrl 0x81f5: Supervisory, Receiver not Ready, rcv seq 64, Flags [Poll], length 46
13:36:04.943584 80:ce:b9:71:e2:37 > ff:ff:ff:ff:ff:ff, 802.3, length 46: LLC, dsap Null (0x00) Individual, ssap Null (0x00) Command, ctrl 0x81f5: Supervisory, Receiver not Ready, rcv seq 64, Flags [Poll], length 46
13:36:05.874160 50:5b:c2:5b:84:49 > d8:24:bd:91:5d:40, ethertype IPv4 (0x0800), length 362: 172.31.12.136.47518 > 180.149.59.136.80: Flags [P.], seq 2678483400:2678483696, ack 3756367658, win 237, options [nop,nop,TS val 1724156358 ecr 256661721], length 296: HTTP: GET /success.txt HTTP/1.1
13:36:05.876103 d8:24:bd:91:5d:40 > 50:5b:c2:5b:84:49, ethertype IPv4 (0x0800), length 66: 180.149.59.136.80 > 172.31.12.136.47518: Flags [.], ack 296, win 3752, options [nop,nop,TS val 256662618 ecr 1724156358], length 0
13:36:05.918228 d8:24:bd:91:5d:40 > 50:5b:c2:5b:84:49, ethertype IPv4 (0x0800), length 450: 180.149.59.136.80 > 172.31.12.136.47518: Flags [P.], seq 1:385, ack 296, win 3752, options [nop,nop,TS val 256662622 ecr 1724156358], length 384: HTTP: HTTP/1.1 200 OK
13:36:05.918304 50:5b:c2:5b:84:49 > d8:24:bd:91:5d:40, ethertype IPv4 (0x0800), length 66: 172.31.12.136.47518 > 180.149.59.136.80: Flags [.], ack 385, win 245, options [nop,nop,TS val 1724156402 ecr 256662622], length 0
13:36:06.888257 e8:ed:f3:96:e6:9d > 01:80:c2:00:00:00, 802.3, length 46: LLC, dsap STP (0x42) Individual, ssap STP (0x42) Command, ctrl 0x03: STP 802.1d, Config, Flags [Topology change], bridge-id 8001.e8:ed:f3:96:e6:80.801d, length 43
13:36:06.888270 e8:ed:f3:96:e6:9d > 01:80:c2:00:00:00, 802.3, length 46: LLC, dsap STP (0x42) Individual, ssap STP (0x42) Command, ctrl 0x03: STP 802.1d, Config, Flags [Topology change], bridge-id 8001.e8:ed:f3:96:e6:80.801d, length 43
13:36:08.167985 50:5b:c2:5b:84:49 > d8:24:bd:91:5d:40, ethertype IPv4 (0x0800), length 66: 172.31.12.136.33680 > 117.18.237.29.80: Flags [.], ack 1818628599, win 241, options [nop,nop,TS val 1922890567 ecr 256661823], length 0
13:36:08.170209 d8:24:bd:91:5d:40 > 50:5b:c2:5b:84:49, ethertype IPv4 (0x0800), length 66: 117.18.237.29.80 > 172.31.12.136.33680: Flags [.], ack 1, win 3216, options [nop,nop,TS val 256662847 ecr 1922859993], length 0
13:36:10.676674 a8:3e:0e:73:c2:4b > ff:ff:ff:ff:ff:ff, 802.3, length 46: LLC, dsap Null (0x00) Individual, ssap Null (0x00) Command, ctrl 0xaf: Unnumbered, xid, Flags [Command], length 46
13:36:10.676683 a8:3e:0e:73:c2:4b > ff:ff:ff:ff:ff:ff, 802.3, length 46: LLC, dsap Null (0x00) Individual, ssap Null (0x00) Command, ctrl 0xaf: Unnumbered, xid, Flags [Command], length 46
13:36:16.104041 50:5b:c2:5b:84:49 > d8:24:bd:91:5d:40, ethertype IPv4 (0x0800), length 66: 172.31.12.136.47518 > 180.149.59.136.80: Flags [.], ack 385, win 245, options [nop,nop,TS val 1724166588 ecr 256662622], length 0
13:36:16.108834 d8:24:bd:91:5d:40 > 50:5b:c2:5b:84:49, ethertype IPv4 (0x0800), length 66: 180.149.59.136.80 > 172.31.12.136.47518: Flags [.], ack 296, win 3752, options [nop,nop,TS val 256663641 ecr 1724156402], length 0
13:36:16.108898 d8:24:bd:91:5d:40 > 50:5b:c2:5b:84:49, ethertype IPv4 (0x0800), length 66: 180.149.59.136.80 > 172.31.12.136.47518: Flags [.], ack 296, win 3752, options [nop,nop,TS val 256663641 ecr 1724156402], length 0
13:36:17.377212 50:5b:c2:5b:84:49 > d8:24:bd:91:5d:40, ethertype IPv4 (0x0800), length 74: 172.31.12.136.47178 > 52.89.110.41.443: Flags [S], seq 927027409, win 29200, options [mss 1460,sackOK,TS val 3033403109 ecr 0,nop,wscale 7], length 0
13:36:17.382159 50:5b:c2:5b:84:49 > d8:24:bd:91:5d:40, ethertype IPv4 (0x0800), length 74: 172.31.12.136.39860 > 52.89.38.17.443: Flags [S], seq 1980682369, win 29200, options [mss 1460,sackOK,TS val 1843050982 ecr 0,nop,wscale 7], length 0
13:36:17.628120 50:5b:c2:5b:84:49 > d8:24:bd:91:5d:40, ethertype IPv4 (0x0800), length 74: 172.31.12.136.39862 > 52.89.38.17.443: Flags [S], seq 3682660278, win 29200, options [mss 1460,sackOK,TS val 1843051228 ecr 0,nop,wscale 7], length 0
13:36:17.632993 50:5b:c2:5b:84:49 > d8:24:bd:91:5d:40, ethertype IPv4 (0x0800), length 74: 172.31.12.136.39864 > 52.89.38.17.443: Flags [S], seq 3518853631, win 29200, options [mss 1460,sackOK,TS val 1843051233 ecr 0,nop,wscale 7], length 0
13:36:17.686118 d8:24:bd:91:5d:40 > 50:5b:c2:5b:84:49, ethertype IPv4 (0x0800), length 74: 52.89.38.17.443 > 172.31.12.136.39860: Flags [S.], seq 1207452412, ack 1980682370, win 26847, options [mss 1460,sackOK,TS val 1443485399 ecr 1843050982,nop,wscale 8], length 0
13:36:17.686242 50:5b:c2:5b:84:49 > d8:24:bd:91:5d:40, ethertype IPv4 (0x0800), length 66: 172.31.12.136.39860 > 52.89.38.17.443: Flags [.], ack 1, win 229, options [nop,nop,TS val 1843051286 ecr 1443485399], length 0
13:36:17.686312 d8:24:bd:91:5d:40 > 50:5b:c2:5b:84:49, ethertype IPv4 (0x0800), length 74: 52.89.110.41.443 > 172.31.12.136.47178: Flags [S.], seq 3144759996, ack 927027410, win 26847, options [mss 1460,sackOK,TS val 1169272854 ecr 3033403109,nop,wscale 8], length 0
13:36:17.686359 50:5b:c2:5b:84:49 > d8:24:bd:91:5d:40, ethertype IPv4 (0x0800), length 66: 172.31.12.136.47178 > 52.89.110.41.443: Flags [.], ack 1, win 229, options [nop,nop,TS val 3033403418 ecr 1169272854], length 0
13:36:17.686927 50:5b:c2:5b:84:49 > d8:24:bd:91:5d:40, ethertype IPv4 (0x0800), length 279: 172.31.12.136.39860 > 52.89.38.17.443: Flags [P.], seq 1:214, ack 1, win 229, options [nop,nop,TS val 1843051287 ecr 1443485399], length 213
13:36:17.687729 50:5b:c2:5b:84:49 > d8:24:bd:91:5d:40, ethertype IPv4 (0x0800), length 279: 172.31.12.136.47178 > 52.89.110.41.443: Flags [P.], seq 1:214, ack 1, win 229, options [nop,nop,TS val 3033403419 ecr 1169272854], length 213
13:36:17.931808 d8:24:bd:91:5d:40 > 50:5b:c2:5b:84:49, ethertype IPv4 (0x0800), length 74: 52.89.38.17.443 > 172.31.12.136.39862: Flags [S.], seq 2000511068, ack 3682660279, win 26847, options [mss 1460,sackOK,TS val 1443485463 ecr 1843051228,nop,wscale 8], length 0
13:36:17.931933 50:5b:c2:5b:84:49 > d8:24:bd:91:5d:40, ethertype IPv4 (0x0800), length 66: 172.31.12.136.39862 > 52.89.38.17.443: Flags [.], ack 1, win 229, options [nop,nop,TS val 1843051532 ecr 1443485463], length 0
13:36:17.932530 50:5b:c2:5b:84:49 > d8:24:bd:91:5d:40, ethertype IPv4 (0x0800), length 279: 172.31.12.136.39862 > 52.89.38.17.443: Flags [P.], seq 1:214, ack 1, win 229, options [nop,nop,TS val 1843051532 ecr 1443485463], length 213
13:36:17.952960 d8:24:bd:91:5d:40 > 50:5b:c2:5b:84:49, ethertype IPv4 (0x0800), length 74: 52.89.38.17.443 > 172.31.12.136.39864: Flags [S.], seq 20872453, ack 3518853632, win 26847, options [mss 1460,sackOK,TS val 1443485463 ecr 1843051233,nop,wscale 8], length 0
13:36:17.953082 50:5b:c2:5b:84:49 > d8:24:bd:91:5d:40, ethertype IPv4 (0x0800), length 66: 172.31.12.136.39864 > 52.89.38.17.443: Flags [.], ack 1, win 229, options [nop,nop,TS val 1843051553 ecr 1443485463], length 0
13:36:17.953824 50:5b:c2:5b:84:49 > d8:24:bd:91:5d:40, ethertype IPv4 (0x0800), length 279: 172.31.12.136.39864 > 52.89.38.17.443: Flags [P.], seq 1:214, ack 1, win 229, options [nop,nop,TS val 1843051554 ecr 1443485463], length 213
13:36:17.990673 d8:24:bd:91:5d:40 > 50:5b:c2:5b:84:49, ethertype IPv4 (0x0800), length 66: 52.89.38.17.443 > 172.31.12.136.39860: Flags [.], ack 214, win 119, options [nop,nop,TS val 1443485481 ecr 1843051287], length 0
13:36:17.991699 d8:24:bd:91:5d:40 > 50:5b:c2:5b:84:49, ethertype IPv4 (0x0800), length 1514: 52.89.38.17.443 > 172.31.12.136.39860: Flags [.], seq 1:1449, ack 214, win 119, options [nop,nop,TS val 1443485481 ecr 1843051287], length 1448
13:36:17.991759 50:5b:c2:5b:84:49 > d8:24:bd:91:5d:40, ethertype IPv4 (0x0800), length 66: 172.31.12.136.39860 > 52.89.38.17.443: Flags [.], ack 1449, win 251, options [nop,nop,TS val 1843051592 ecr 1443485481], length 0
13:36:17.991830 d8:24:bd:91:5d:40 > 50:5b:c2:5b:84:49, ethertype IPv4 (0x0800), length 1514: 52.89.38.17.443 > 172.31.12.136.39860: Flags [.], seq 1449:2897, ack 214, win 119, options [nop,nop,TS val 1443485481 ecr 1843051287], length 1448
13:36:17.991875 50:5b:c2:5b:84:49 > d8:24:bd:91:5d:40, ethertype IPv4 (0x0800), length 66: 172.31.12.136.39860 > 52.89.38.17.443: Flags [.], ack 2897, win 274, options [nop,nop,TS val 1843051592 ecr 1443485481], length 0
13:36:17.991909 d8:24:bd:91:5d:40 > 50:5b:c2:5b:84:49, ethertype IPv4 (0x0800), length 573: 52.89.38.17.443 > 172.31.12.136.39860: Flags [P.], seq 2897:3404, ack 214, win 119, options [nop,nop,TS val 1443485481 ecr 1843051287], length 507
13:36:17.991939 50:5b:c2:5b:84:49 > d8:24:bd:91:5d:40, ethertype IPv4 (0x0800), length 66: 172.31.12.136.39860 > 52.89.38.17.443: Flags [.], ack 3404, win 296, options [nop,nop,TS val 1843051592 ecr 1443485481], length 0
13:36:17.995568 d8:24:bd:91:5d:40 > 50:5b:c2:5b:84:49, ethertype IPv4 (0x0800), length 66: 52.89.110.41.443 > 172.31.12.136.47178: Flags [.], ack 214, win 110, options [nop,nop,TS val 1169272931 ecr 3033403419], length 0
13:36:17.998125 d8:24:bd:91:5d:40 > 50:5b:c2:5b:84:49, ethertype IPv4 (0x0800), length 1514: 52.89.110.41.443 > 172.31.12.136.47178: Flags [.], seq 1:1449, ack 214, win 110, options [nop,nop,TS val 1169272931 ecr 3033403419], length 1448
13:36:17.998197 50:5b:c2:5b:84:49 > d8:24:bd:91:5d:40, ethertype IPv4 (0x0800), length 66: 172.31.12.136.47178 > 52.89.110.41.443: Flags [.], ack 1449, win 251, options [nop,nop,TS val 3033403730 ecr 1169272931], length 0
13:36:17.998266 d8:24:bd:91:5d:40 > 50:5b:c2:5b:84:49, ethertype IPv4 (0x0800), length 1514: 52.89.110.41.443 > 172.31.12.136.47178: Flags [.], seq 1449:2897, ack 214, win 110, options [nop,nop,TS val 1169272931 ecr 3033403419], length 1448
13:36:17.998301 50:5b:c2:5b:84:49 > d8:24:bd:91:5d:40, ethertype IPv4 (0x0800), length 66: 172.31.12.136.47178 > 52.89.110.41.443: Flags [.], ack 2897, win 274, options [nop,nop,TS val 3033403730 ecr 1169272931], length 0
13:36:17.998333 d8:24:bd:91:5d:40 > 50:5b:c2:5b:84:49, ethertype IPv4 (0x0800), length 573: 52.89.110.41.443 > 172.31.12.136.47178: Flags [P.], seq 2897:3404, ack 214, win 110, options [nop,nop,TS val 1169272931 ecr 3033403419], length 507
13:36:17.998360 50:5b:c2:5b:84:49 > d8:24:bd:91:5d:40, ethertype IPv4 (0x0800), length 66: 172.31.12.136.47178 > 52.89.110.41.443: Flags [.], ack 3404, win 296, options [nop,nop,TS val 3033403730 ecr 1169272931], length 0
13:36:18.008263 50:5b:c2:5b:84:49 > d8:24:bd:91:5d:40, ethertype IPv4 (0x0800), length 192: 172.31.12.136.39860 > 52.89.38.17.443: Flags [P.], seq 214:340, ack 3404, win 296, options [nop,nop,TS val 1843051608 ecr 1443485481], length 126
13:36:18.008562 50:5b:c2:5b:84:49 > d8:24:bd:91:5d:40, ethertype IPv4 (0x0800), length 516: 172.31.12.136.33680 > 117.18.237.29.80: Flags [P.], seq 1:451, ack 1, win 241, options [nop,nop,TS val 1922900407 ecr 256662847], length 450: HTTP: POST / HTTP/1.1
13:36:18.010493 d8:24:bd:91:5d:40 > 50:5b:c2:5b:84:49, ethertype IPv4 (0x0800), length 66: 117.18.237.29.80 > 172.31.12.136.33680: Flags [.], ack 451, win 3752, options [nop,nop,TS val 256663831 ecr 1922900407], length 0
13:36:18.022116 50:5b:c2:5b:84:49 > d8:24:bd:91:5d:40, ethertype IPv4 (0x0800), length 192: 172.31.12.136.47178 > 52.89.110.41.443: Flags [P.], seq 214:340, ack 3404, win 296, options [nop,nop,TS val 3033403754 ecr 1169272931], length 126
13:36:18.022453 50:5b:c2:5b:84:49 > d8:24:bd:91:5d:40, ethertype IPv4 (0x0800), length 74: 172.31.12.136.33690 > 117.18.237.29.80: Flags [S], seq 2252489397, win 29200, options [mss 1460,sackOK,TS val 1922900421 ecr 0,nop,wscale 7], length 0
13:36:18.024494 d8:24:bd:91:5d:40 > 50:5b:c2:5b:84:49, ethertype IPv4 (0x0800), length 74: 117.18.237.29.80 > 172.31.12.136.33690: Flags [S.], seq 3157605182, ack 2252489398, win 5792, options [mss 1460,sackOK,TS val 256663833 ecr 1922900421,nop,wscale 1], length 0
13:36:18.024567 50:5b:c2:5b:84:49 > d8:24:bd:91:5d:40, ethertype IPv4 (0x0800), length 66: 172.31.12.136.33690 > 117.18.237.29.80: Flags [.], ack 1, win 229, options [nop,nop,TS val 1922900423 ecr 256663833], length 0
13:36:18.024891 50:5b:c2:5b:84:49 > d8:24:bd:91:5d:40, ethertype IPv4 (0x0800), length 516: 172.31.12.136.33690 > 117.18.237.29.80: Flags [P.], seq 1:451, ack 1, win 229, options [nop,nop,TS val 1922900424 ecr 256663833], length 450: HTTP: POST / HTTP/1.1
13:36:18.027664 d8:24:bd:91:5d:40 > 50:5b:c2:5b:84:49, ethertype IPv4 (0x0800), length 66: 117.18.237.29.80 > 172.31.12.136.33690: Flags [.], ack 451, win 3216, options [nop,nop,TS val 256663833 ecr 1922900424], length 0
13:36:18.080166 d8:24:bd:91:5d:40 > 50:5b:c2:5b:84:49, ethertype IPv4 (0x0800), length 854: 117.18.237.29.80 > 172.31.12.136.33680: Flags [P.], seq 1:789, ack 451, win 3752, options [nop,nop,TS val 256663838 ecr 1922900407], length 788: HTTP: HTTP/1.1 200 OK
13:36:18.080242 50:5b:c2:5b:84:49 > d8:24:bd:91:5d:40, ethertype IPv4 (0x0800), length 66: 172.31.12.136.33680 > 117.18.237.29.80: Flags [.], ack 789, win 253, options [nop,nop,TS val 1922900479 ecr 256663838], length 0
13:36:18.083642 50:5b:c2:5b:84:49 > d8:24:bd:91:5d:40, ethertype IPv4 (0x0800), length 917: 172.31.12.136.39860 > 52.89.38.17.443: Flags [P.], seq 340:1191, ack 3404, win 296, options [nop,nop,TS val 1843051683 ecr 1443485481], length 851
13:36:18.182104 d8:24:bd:91:5d:40 > 50:5b:c2:5b:84:49, ethertype IPv4 (0x0800), length 854: 117.18.237.29.80 > 172.31.12.136.33690: Flags [P.], seq 1:789, ack 451, win 3216, options [nop,nop,TS val 256663848 ecr 1922900424], length 788: HTTP: HTTP/1.1 200 OK
13:36:18.182182 50:5b:c2:5b:84:49 > d8:24:bd:91:5d:40, ethertype IPv4 (0x0800), length 66: 172.31.12.136.33690 > 117.18.237.29.80: Flags [.], ack 789, win 241, options [nop,nop,TS val 1922900581 ecr 256663848], length 0
13:36:18.185287 50:5b:c2:5b:84:49 > d8:24:bd:91:5d:40, ethertype IPv4 (0x0800), length 1514: 172.31.12.136.47178 > 52.89.110.41.443: Flags [.], seq 340:1788, ack 3404, win 296, options [nop,nop,TS val 3033403917 ecr 1169272931], length 1448
13:36:18.185332 50:5b:c2:5b:84:49 > d8:24:bd:91:5d:40, ethertype IPv4 (0x0800), length 1514: 172.31.12.136.47178 > 52.89.110.41.443: Flags [.], seq 1788:3236, ack 3404, win 296, options [nop,nop,TS val 3033403917 ecr 1169272931], length 1448
13:36:18.185856 50:5b:c2:5b:84:49 > d8:24:bd:91:5d:40, ethertype IPv4 (0x0800), length 1514: 172.31.12.136.47178 > 52.89.110.41.443: Flags [.], seq 3236:4684, ack 3404, win 296, options [nop,nop,TS val 3033403918 ecr 1169272931], length 1448
13:36:18.185887 50:5b:c2:5b:84:49 > d8:24:bd:91:5d:40, ethertype IPv4 (0x0800), length 1514: 172.31.12.136.47178 > 52.89.110.41.443: Flags [.], seq 4684:6132, ack 3404, win 296, options [nop,nop,TS val 3033403918 ecr 1169272931], length 1448
13:36:18.187049 50:5b:c2:5b:84:49 > d8:24:bd:91:5d:40, ethertype IPv4 (0x0800), length 874: 172.31.12.136.47178 > 52.89.110.41.443: Flags [P.], seq 6132:6940, ack 3404, win 296, options [nop,nop,TS val 3033403919 ecr 1169272931], length 808
13:36:18.237351 d8:24:bd:91:5d:40 > 50:5b:c2:5b:84:49, ethertype IPv4 (0x0800), length 66: 52.89.38.17.443 > 172.31.12.136.39862: Flags [.], ack 214, win 119, options [nop,nop,TS val 1443485542 ecr 1843051532], length 0
13:36:18.239088 d8:24:bd:91:5d:40 > 50:5b:c2:5b:84:49, ethertype IPv4 (0x0800), length 1514: 52.89.38.17.443 > 172.31.12.136.39862: Flags [.], seq 1:1449, ack 214, win 119, options [nop,nop,TS val 1443485542 ecr 1843051532], length 1448
13:36:18.239164 50:5b:c2:5b:84:49 > d8:24:bd:91:5d:40, ethertype IPv4 (0x0800), length 66: 172.31.12.136.39862 > 52.89.38.17.443: Flags [.], ack 1449, win 251, options [nop,nop,TS val 1843051839 ecr 1443485542], length 0
13:36:18.239231 d8:24:bd:91:5d:40 > 50:5b:c2:5b:84:49, ethertype IPv4 (0x0800), length 1514: 52.89.38.17.443 > 172.31.12.136.39862: Flags [.], seq 1449:2897, ack 214, win 119, options [nop,nop,TS val 1443485542 ecr 1843051532], length 1448
13:36:18.239261 50:5b:c2:5b:84:49 > d8:24:bd:91:5d:40, ethertype IPv4 (0x0800), length 66: 172.31.12.136.39862 > 52.89.38.17.443: Flags [.], ack 2897, win 274, options [nop,nop,TS val 1843051839 ecr 1443485542], length 0
13:36:18.239291 d8:24:bd:91:5d:40 > 50:5b:c2:5b:84:49, ethertype IPv4 (0x0800), length 573: 52.89.38.17.443 > 172.31.12.136.39862: Flags [P.], seq 2897:3404, ack 214, win 119, options [nop,nop,TS val 1443485542 ecr 1843051532], length 507
13:36:18.239310 50:5b:c2:5b:84:49 > d8:24:bd:91:5d:40, ethertype IPv4 (0x0800), length 66: 172.31.12.136.39862 > 52.89.38.17.443: Flags [.], ack 3404, win 296, options [nop,nop,TS val 1843051839 ecr 1443485542], length 0
13:36:18.251123 50:5b:c2:5b:84:49 > d8:24:bd:91:5d:40, ethertype IPv4 (0x0800), length 192: 172.31.12.136.39862 > 52.89.38.17.443: Flags [P.], seq 214:340, ack 3404, win 296, options [nop,nop,TS val 1843051851 ecr 1443485542], length 126
13:36:18.268121 d8:24:bd:91:5d:40 > 50:5b:c2:5b:84:49, ethertype IPv4 (0x0800), length 66: 52.89.38.17.443 > 172.31.12.136.39864: Flags [.], ack 214, win 119, options [nop,nop,TS val 1443485548 ecr 1843051554], length 0
13:36:18.270639 d8:24:bd:91:5d:40 > 50:5b:c2:5b:84:49, ethertype IPv4 (0x0800), length 1514: 52.89.38.17.443 > 172.31.12.136.39864: Flags [.], seq 1:1449, ack 214, win 119, options [nop,nop,TS val 1443485548 ecr 1843051554], length 1448
13:36:18.270716 50:5b:c2:5b:84:49 > d8:24:bd:91:5d:40, ethertype IPv4 (0x0800), length 66: 172.31.12.136.39864 > 52.89.38.17.443: Flags [.], ack 1449, win 251, options [nop,nop,TS val 1843051870 ecr 1443485548], length 0
13:36:18.270806 d8:24:bd:91:5d:40 > 50:5b:c2:5b:84:49, ethertype IPv4 (0x0800), length 1514: 52.89.38.17.443 > 172.31.12.136.39864: Flags [.], seq 1449:2897, ack 214, win 119, options [nop,nop,TS val 1443485548 ecr 1843051554], length 1448
13:36:18.270858 50:5b:c2:5b:84:49 > d8:24:bd:91:5d:40, ethertype IPv4 (0x0800), length 66: 172.31.12.136.39864 > 52.89.38.17.443: Flags [.], ack 2897, win 274, options [nop,nop,TS val 1843051871 ecr 1443485548], length 0
13:36:18.270907 d8:24:bd:91:5d:40 > 50:5b:c2:5b:84:49, ethertype IPv4 (0x0800), length 573: 52.89.38.17.443 > 172.31.12.136.39864: Flags [P.], seq 2897:3404, ack 214, win 119, options [nop,nop,TS val 1443485548 ecr 1843051554], length 507
13:36:18.270975 50:5b:c2:5b:84:49 > d8:24:bd:91:5d:40, ethertype IPv4 (0x0800), length 66: 172.31.12.136.39864 > 52.89.38.17.443: Flags [.], ack 3404, win 296, options [nop,nop,TS val 1843051871 ecr 1443485548], length 0
13:36:18.281592 50:5b:c2:5b:84:49 > d8:24:bd:91:5d:40, ethertype IPv4 (0x0800), length 192: 172.31.12.136.39864 > 52.89.38.17.443: Flags [P.], seq 214:340, ack 3404, win 296, options [nop,nop,TS val 1843051881 ecr 1443485548], length 126
13:36:18.312165 d8:24:bd:91:5d:40 > 50:5b:c2:5b:84:49, ethertype IPv4 (0x0800), length 117: 52.89.38.17.443 > 172.31.12.136.39860: Flags [P.], seq 3404:3455, ack 340, win 119, options [nop,nop,TS val 1443485561 ecr 1843051608], length 51
13:36:18.330522 d8:24:bd:91:5d:40 > 50:5b:c2:5b:84:49, ethertype IPv4 (0x0800), length 117: 52.89.110.41.443 > 172.31.12.136.47178: Flags [P.], seq 3404:3455, ack 340, win 110, options [nop,nop,TS val 1169273015 ecr 3033403754], length 51
13:36:18.355593 50:5b:c2:5b:84:49 > d8:24:bd:91:5d:40, ethertype IPv4 (0x0800), length 66: 172.31.12.136.39860 > 52.89.38.17.443: Flags [.], ack 3455, win 296, options [nop,nop,TS val 1843051955 ecr 1443485561], length 0
13:36:18.371581 50:5b:c2:5b:84:49 > d8:24:bd:91:5d:40, ethertype IPv4 (0x0800), length 66: 172.31.12.136.47178 > 52.89.110.41.443: Flags [.], ack 3455, win 296, options [nop,nop,TS val 3033404103 ecr 1169273015], length 0
13:36:18.387888 d8:24:bd:91:5d:40 > 50:5b:c2:5b:84:49, ethertype IPv4 (0x0800), length 222: 52.89.38.17.443 > 172.31.12.136.39860: Flags [P.], seq 3455:3611, ack 1191, win 125, options [nop,nop,TS val 1443485580 ecr 1843051683], length 156
13:36:18.387989 50:5b:c2:5b:84:49 > d8:24:bd:91:5d:40, ethertype IPv4 (0x0800), length 66: 172.31.12.136.39860 > 52.89.38.17.443: Flags [.], ack 3611, win 319, options [nop,nop,TS val 1843051988 ecr 1443485580], length 0
13:36:18.493975 d8:24:bd:91:5d:40 > 50:5b:c2:5b:84:49, ethertype IPv4 (0x0800), length 66: 52.89.110.41.443 > 172.31.12.136.47178: Flags [.], ack 3236, win 179, options [nop,nop,TS val 1169273056 ecr 3033403917], length 0
13:36:18.495080 d8:24:bd:91:5d:40 > 50:5b:c2:5b:84:49, ethertype IPv4 (0x0800), length 66: 52.89.110.41.443 > 172.31.12.136.47178: Flags [.], ack 6132, win 202, options [nop,nop,TS val 1169273056 ecr 3033403918], length 0
13:36:18.496173 d8:24:bd:91:5d:40 > 50:5b:c2:5b:84:49, ethertype IPv4 (0x0800), length 222: 52.89.110.41.443 > 172.31.12.136.47178: Flags [P.], seq 3455:3611, ack 6940, win 213, options [nop,nop,TS val 1169273056 ecr 3033403919], length 156
13:36:18.496254 50:5b:c2:5b:84:49 > d8:24:bd:91:5d:40, ethertype IPv4 (0x0800), length 66: 172.31.12.136.47178 > 52.89.110.41.443: Flags [.], ack 3611, win 319, options [nop,nop,TS val 3033404228 ecr 1169273056], length 0
13:36:18.556416 d8:24:bd:91:5d:40 > 50:5b:c2:5b:84:49, ethertype IPv4 (0x0800), length 117: 52.89.38.17.443 > 172.31.12.136.39862: Flags [P.], seq 3404:3455, ack 340, win 119, options [nop,nop,TS val 1443485622 ecr 1843051851], length 51
13:36:18.561010 e8:ed:f3:96:e6:9d > 01:80:c2:00:00:00, 802.3, length 46: LLC, dsap STP (0x42) Individual, ssap STP (0x42) Command, ctrl 0x03: STP 802.1d, Config, Flags [Topology change], bridge-id 8001.e8:ed:f3:96:e6:80.801d, length 43
13:36:18.561022 e8:ed:f3:96:e6:9d > 01:80:c2:00:00:00, 802.3, length 46: LLC, dsap STP (0x42) Individual, ssap STP (0x42) Command, ctrl 0x03: STP 802.1d, Config, Flags [Topology change], bridge-id 8001.e8:ed:f3:96:e6:80.801d, length 43
13:36:18.596060 d8:24:bd:91:5d:40 > 50:5b:c2:5b:84:49, ethertype IPv4 (0x0800), length 117: 52.89.38.17.443 > 172.31.12.136.39864: Flags [P.], seq 3404:3455, ack 340, win 119, options [nop,nop,TS val 1443485630 ecr 1843051881], length 51
13:36:18.599892 50:5b:c2:5b:84:49 > d8:24:bd:91:5d:40, ethertype IPv4 (0x0800), length 66: 172.31.12.136.39862 > 52.89.38.17.443: Flags [.], ack 3455, win 296, options [nop,nop,TS val 1843052200 ecr 1443485622], length 0
13:36:18.639986 50:5b:c2:5b:84:49 > d8:24:bd:91:5d:40, ethertype IPv4 (0x0800), length 66: 172.31.12.136.39864 > 52.89.38.17.443: Flags [.], ack 3455, win 296, options [nop,nop,TS val 1843052240 ecr 1443485630], length 0
13:36:21.119067 80:ce:b9:71:e2:37 > ff:ff:ff:ff:ff:ff, 802.3, length 46: LLC, dsap Null (0x00) Individual, ssap Null (0x00) Command, ctrl 0x81f5: Supervisory, Receiver not Ready, rcv seq 64, Flags [Poll], length 46
13:36:21.121254 80:ce:b9:71:e2:37 > ff:ff:ff:ff:ff:ff, 802.3, length 46: LLC, dsap Null (0x00) Individual, ssap Null (0x00) Command, ctrl 0x81f5: Supervisory, Receiver not Ready, rcv seq 64, Flags [Poll], length 46
13:36:23.689643 50:5b:c2:5b:84:49 > d8:24:bd:91:5d:40, ethertype IPv4 (0x0800), length 97: 172.31.12.136.39864 > 52.89.38.17.443: Flags [P.], seq 340:371, ack 3455, win 296, options [nop,nop,TS val 1843057290 ecr 1443485630], length 31
13:36:23.689735 50:5b:c2:5b:84:49 > d8:24:bd:91:5d:40, ethertype IPv4 (0x0800), length 66: 172.31.12.136.39864 > 52.89.38.17.443: Flags [F.], seq 371, ack 3455, win 296, options [nop,nop,TS val 1843057290 ecr 1443485630], length 0
13:36:23.690081 50:5b:c2:5b:84:49 > d8:24:bd:91:5d:40, ethertype IPv4 (0x0800), length 97: 172.31.12.136.39862 > 52.89.38.17.443: Flags [P.], seq 340:371, ack 3455, win 296, options [nop,nop,TS val 1843057290 ecr 1443485622], length 31
13:36:23.690141 50:5b:c2:5b:84:49 > d8:24:bd:91:5d:40, ethertype IPv4 (0x0800), length 66: 172.31.12.136.39862 > 52.89.38.17.443: Flags [F.], seq 371, ack 3455, win 296, options [nop,nop,TS val 1843057290 ecr 1443485622], length 0
13:36:23.994523 d8:24:bd:91:5d:40 > 50:5b:c2:5b:84:49, ethertype IPv4 (0x0800), length 66: 52.89.38.17.443 > 172.31.12.136.39862: Flags [F.], seq 3486, ack 371, win 119, options [nop,nop,TS val 1443486982 ecr 1843057290], length 0
13:36:23.994632 50:5b:c2:5b:84:49 > d8:24:bd:91:5d:40, ethertype IPv4 (0x0800), length 54: 172.31.12.136.39862 > 52.89.38.17.443: Flags [R], seq 3682660649, win 0, length 0
13:36:23.994698 d8:24:bd:91:5d:40 > 50:5b:c2:5b:84:49, ethertype IPv4 (0x0800), length 97: 52.89.38.17.443 > 172.31.12.136.39862: Flags [P.], seq 3455:3486, ack 371, win 119, options [nop,nop,TS val 1443486981 ecr 1843057290], length 31
13:36:23.994728 50:5b:c2:5b:84:49 > d8:24:bd:91:5d:40, ethertype IPv4 (0x0800), length 54: 172.31.12.136.39862 > 52.89.38.17.443: Flags [R], seq 3682660649, win 0, length 0
13:36:23.994755 d8:24:bd:91:5d:40 > 50:5b:c2:5b:84:49, ethertype IPv4 (0x0800), length 66: 52.89.38.17.443 > 172.31.12.136.39862: Flags [.], ack 372, win 119, options [nop,nop,TS val 1443486982 ecr 1843057290], length 0
13:36:23.994777 50:5b:c2:5b:84:49 > d8:24:bd:91:5d:40, ethertype IPv4 (0x0800), length 54: 172.31.12.136.39862 > 52.89.38.17.443: Flags [R], seq 3682660650, win 0, length 0
13:36:24.007507 d8:24:bd:91:5d:40 > 50:5b:c2:5b:84:49, ethertype IPv4 (0x0800), length 97: 52.89.38.17.443 > 172.31.12.136.39864: Flags [P.], seq 3455:3486, ack 371, win 119, options [nop,nop,TS val 1443486982 ecr 1843057290], length 31
13:36:24.007623 50:5b:c2:5b:84:49 > d8:24:bd:91:5d:40, ethertype IPv4 (0x0800), length 54: 172.31.12.136.39864 > 52.89.38.17.443: Flags [R], seq 3518854002, win 0, length 0
13:36:24.007688 d8:24:bd:91:5d:40 > 50:5b:c2:5b:84:49, ethertype IPv4 (0x0800), length 66: 52.89.38.17.443 > 172.31.12.136.39864: Flags [F.], seq 3486, ack 371, win 119, options [nop,nop,TS val 1443486982 ecr 1843057290], length 0
13:36:24.007720 50:5b:c2:5b:84:49 > d8:24:bd:91:5d:40, ethertype IPv4 (0x0800), length 54: 172.31.12.136.39864 > 52.89.38.17.443: Flags [R], seq 3518854002, win 0, length 0
13:36:24.007746 d8:24:bd:91:5d:40 > 50:5b:c2:5b:84:49, ethertype IPv4 (0x0800), length 66: 52.89.38.17.443 > 172.31.12.136.39864: Flags [.], ack 372, win 119, options [nop,nop,TS val 1443486982 ecr 1843057290], length 0
13:36:24.007767 50:5b:c2:5b:84:49 > d8:24:bd:91:5d:40, ethertype IPv4 (0x0800), length 54: 172.31.12.136.39864 > 52.89.38.17.443: Flags [R], seq 3518854003, win 0, length 0
13:36:24.644790 d8:24:bd:91:5d:40 > 50:5b:c2:5b:84:49, ethertype IPv4 (0x0800), length 66: 52.89.38.17.443 > 172.31.12.136.39862: Flags [F.], seq 3486, ack 372, win 119, options [nop,nop,TS val 1443487144 ecr 1843057290], length 0
13:36:24.644875 50:5b:c2:5b:84:49 > d8:24:bd:91:5d:40, ethertype IPv4 (0x0800), length 54: 172.31.12.136.39862 > 52.89.38.17.443: Flags [R], seq 3682660650, win 0, length 0
13:36:24.688709 d8:24:bd:91:5d:40 > 50:5b:c2:5b:84:49, ethertype IPv4 (0x0800), length 66: 52.89.38.17.443 > 172.31.12.136.39864: Flags [F.], seq 3486, ack 372, win 119, options [nop,nop,TS val 1443487152 ecr 1843057290], length 0
13:36:24.688789 50:5b:c2:5b:84:49 > d8:24:bd:91:5d:40, ethertype IPv4 (0x0800), length 54: 172.31.12.136.39864 > 52.89.38.17.443: Flags [R], seq 3518854003, win 0, length 0
13:36:24.807352 e8:ed:f3:96:e6:9d > 01:80:c2:00:00:00, 802.3, length 46: LLC, dsap STP (0x42) Individual, ssap STP (0x42) Command, ctrl 0x03: STP 802.1d, Config, Flags [Topology change], bridge-id 8001.e8:ed:f3:96:e6:80.801d, length 43
13:36:24.807362 e8:ed:f3:96:e6:9d > 01:80:c2:00:00:00, 802.3, length 46: LLC, dsap STP (0x42) Individual, ssap STP (0x42) Command, ctrl 0x03: STP 802.1d, Config, Flags [Topology change], bridge-id 8001.e8:ed:f3:96:e6:80.801d, length 43
13:36:26.343751 50:5b:c2:5b:84:49 > d8:24:bd:91:5d:40, ethertype IPv4 (0x0800), length 66: 172.31.12.136.47518 > 180.149.59.136.80: Flags [.], ack 385, win 245, options [nop,nop,TS val 1724176829 ecr 256663641], length 0
13:36:26.346209 d8:24:bd:91:5d:40 > 50:5b:c2:5b:84:49, ethertype IPv4 (0x0800), length 66: 180.149.59.136.80 > 172.31.12.136.47518: Flags [.], ack 296, win 3752, options [nop,nop,TS val 256664665 ecr 1724156402], length 0
13:36:26.547363 e8:ed:f3:96:e6:9d > 01:80:c2:00:00:00, 802.3, length 46: LLC, dsap STP (0x42) Individual, ssap STP (0x42) Command, ctrl 0x03: STP 802.1d, Config, Flags [Topology change], bridge-id 8001.e8:ed:f3:96:e6:80.801d, length 43
13:36:26.547386 e8:ed:f3:96:e6:9d > 01:80:c2:00:00:00, 802.3, length 46: LLC, dsap STP (0x42) Individual, ssap STP (0x42) Command, ctrl 0x03: STP 802.1d, Config, Flags [Topology change], bridge-id 8001.e8:ed:f3:96:e6:80.801d, length 43
13:36:28.135532 50:5b:c2:5b:84:49 > d8:24:bd:91:5d:40, ethertype IPv4 (0x0800), length 66: 172.31.12.136.33680 > 117.18.237.29.80: Flags [.], ack 789, win 253, options [nop,nop,TS val 1922910536 ecr 256663838], length 0
13:36:28.137418 d8:24:bd:91:5d:40 > 50:5b:c2:5b:84:49, ethertype IPv4 (0x0800), length 66: 117.18.237.29.80 > 172.31.12.136.33680: Flags [.], ack 451, win 3752, options [nop,nop,TS val 256664844 ecr 1922900479], length 0
13:36:28.183659 50:5b:c2:5b:84:49 > d8:24:bd:91:5d:40, ethertype IPv4 (0x0800), length 66: 172.31.12.136.33690 > 117.18.237.29.80: Flags [.], ack 789, win 241, options [nop,nop,TS val 1922910584 ecr 256663848], length 0
13:36:28.186762 d8:24:bd:91:5d:40 > 50:5b:c2:5b:84:49, ethertype IPv4 (0x0800), length 66: 117.18.237.29.80 > 172.31.12.136.33690: Flags [.], ack 451, win 3216, options [nop,nop,TS val 256664849 ecr 1922900581], length 0
13:36:28.391982 50:5b:c2:5b:84:49 > d8:24:bd:91:5d:40, ethertype IPv4 (0x0800), length 66: 172.31.12.136.39860 > 52.89.38.17.443: Flags [.], ack 3611, win 319, options [nop,nop,TS val 1843061993 ecr 1443485580], length 0
13:36:28.519596 50:5b:c2:5b:84:49 > d8:24:bd:91:5d:40, ethertype IPv4 (0x0800), length 66: 172.31.12.136.47178 > 52.89.110.41.443: Flags [.], ack 3611, win 319, options [nop,nop,TS val 3033414253 ecr 1169273056], length 0
13:36:28.698433 d8:24:bd:91:5d:40 > 50:5b:c2:5b:84:49, ethertype IPv4 (0x0800), length 66: 52.89.38.17.443 > 172.31.12.136.39860: Flags [.], ack 1191, win 125, options [nop,nop,TS val 1443488158 ecr 1843051988], length 0
13:36:28.827589 d8:24:bd:91:5d:40 > 50:5b:c2:5b:84:49, ethertype IPv4 (0x0800), length 66: 52.89.110.41.443 > 172.31.12.136.47178: Flags [.], ack 6940, win 213, options [nop,nop,TS val 1169275639 ecr 3033404228], length 0
13:36:29.296830 50:5b:c2:5b:84:49 > d8:24:bd:91:5d:40, ethertype IPv4 (0x0800), length 74: 172.31.12.136.32878 > 52.40.111.108.443: Flags [S], seq 4106341826, win 29200, options [mss 1460,sackOK,TS val 3277561739 ecr 0,nop,wscale 7], length 0
13:36:29.297204 50:5b:c2:5b:84:49 > d8:24:bd:91:5d:40, ethertype IPv4 (0x0800), length 74: 172.31.12.136.32880 > 52.40.111.108.443: Flags [S], seq 869305137, win 29200, options [mss 1460,sackOK,TS val 3277561740 ecr 0,nop,wscale 7], length 0
13:36:29.548104 50:5b:c2:5b:84:49 > d8:24:bd:91:5d:40, ethertype IPv4 (0x0800), length 74: 172.31.12.136.32882 > 52.40.111.108.443: Flags [S], seq 3710342290, win 29200, options [mss 1460,sackOK,TS val 3277561990 ecr 0,nop,wscale 7], length 0
13:36:29.548423 50:5b:c2:5b:84:49 > d8:24:bd:91:5d:40, ethertype IPv4 (0x0800), length 74: 172.31.12.136.32884 > 52.40.111.108.443: Flags [S], seq 781458977, win 29200, options [mss 1460,sackOK,TS val 3277561991 ecr 0,nop,wscale 7], length 0
13:36:29.619791 d8:24:bd:91:5d:40 > 50:5b:c2:5b:84:49, ethertype IPv4 (0x0800), length 74: 52.40.111.108.443 > 172.31.12.136.32878: Flags [S.], seq 2885125476, ack 4106341827, win 26847, options [mss 1460,sackOK,TS val 87272087 ecr 3277561739,nop,wscale 8], length 0
13:36:29.619904 50:5b:c2:5b:84:49 > d8:24:bd:91:5d:40, ethertype IPv4 (0x0800), length 66: 172.31.12.136.32878 > 52.40.111.108.443: Flags [.], ack 1, win 229, options [nop,nop,TS val 3277562062 ecr 87272087], length 0
13:36:29.619977 d8:24:bd:91:5d:40 > 50:5b:c2:5b:84:49, ethertype IPv4 (0x0800), length 74: 52.40.111.108.443 > 172.31.12.136.32880: Flags [S.], seq 2282880060, ack 869305138, win 26847, options [mss 1460,sackOK,TS val 87272087 ecr 3277561740,nop,wscale 8], length 0
13:36:29.620030 50:5b:c2:5b:84:49 > d8:24:bd:91:5d:40, ethertype IPv4 (0x0800), length 66: 172.31.12.136.32880 > 52.40.111.108.443: Flags [.], ack 1, win 229, options [nop,nop,TS val 3277562062 ecr 87272087], length 0
13:36:29.620682 50:5b:c2:5b:84:49 > d8:24:bd:91:5d:40, ethertype IPv4 (0x0800), length 276: 172.31.12.136.32878 > 52.40.111.108.443: Flags [P.], seq 1:211, ack 1, win 229, options [nop,nop,TS val 3277562063 ecr 87272087], length 210
13:36:29.621391 50:5b:c2:5b:84:49 > d8:24:bd:91:5d:40, ethertype IPv4 (0x0800), length 276: 172.31.12.136.32880 > 52.40.111.108.443: Flags [P.], seq 1:211, ack 1, win 229, options [nop,nop,TS val 3277562064 ecr 87272087], length 210
13:36:29.852095 d8:24:bd:91:5d:40 > 50:5b:c2:5b:84:49, ethertype IPv4 (0x0800), length 74: 52.40.111.108.443 > 172.31.12.136.32884: Flags [S.], seq 2808784742, ack 781458978, win 26847, options [mss 1460,sackOK,TS val 87272151 ecr 3277561991,nop,wscale 8], length 0
13:36:29.852223 50:5b:c2:5b:84:49 > d8:24:bd:91:5d:40, ethertype IPv4 (0x0800), length 66: 172.31.12.136.32884 > 52.40.111.108.443: Flags [.], ack 1, win 229, options [nop,nop,TS val 3277562295 ecr 87272151], length 0
13:36:29.852892 50:5b:c2:5b:84:49 > d8:24:bd:91:5d:40, ethertype IPv4 (0x0800), length 276: 172.31.12.136.32884 > 52.40.111.108.443: Flags [P.], seq 1:211, ack 1, win 229, options [nop,nop,TS val 3277562295 ecr 87272151], length 210
13:36:29.858816 d8:24:bd:91:5d:40 > 50:5b:c2:5b:84:49, ethertype IPv4 (0x0800), length 74: 52.40.111.108.443 > 172.31.12.136.32882: Flags [S.], seq 3457981441, ack 3710342291, win 26847, options [mss 1460,sackOK,TS val 87272151 ecr 3277561990,nop,wscale 8], length 0
13:36:29.858939 50:5b:c2:5b:84:49 > d8:24:bd:91:5d:40, ethertype IPv4 (0x0800), length 66: 172.31.12.136.32882 > 52.40.111.108.443: Flags [.], ack 1, win 229, options [nop,nop,TS val 3277562301 ecr 87272151], length 0
13:36:29.859700 50:5b:c2:5b:84:49 > d8:24:bd:91:5d:40, ethertype IPv4 (0x0800), length 276: 172.31.12.136.32882 > 52.40.111.108.443: Flags [P.], seq 1:211, ack 1, win 229, options [nop,nop,TS val 3277562302 ecr 87272151], length 210
13:36:29.929978 d8:24:bd:91:5d:40 > 50:5b:c2:5b:84:49, ethertype IPv4 (0x0800), length 66: 52.40.111.108.443 > 172.31.12.136.32878: Flags [.], ack 211, win 119, options [nop,nop,TS val 87272183 ecr 3277562063], length 0
13:36:29.933967 d8:24:bd:91:5d:40 > 50:5b:c2:5b:84:49, ethertype IPv4 (0x0800), length 1514: 52.40.111.108.443 > 172.31.12.136.32878: Flags [.], seq 1:1449, ack 211, win 119, options [nop,nop,TS val 87272183 ecr 3277562063], length 1448
13:36:29.934041 50:5b:c2:5b:84:49 > d8:24:bd:91:5d:40, ethertype IPv4 (0x0800), length 66: 172.31.12.136.32878 > 52.40.111.108.443: Flags [.], ack 1449, win 251, options [nop,nop,TS val 3277562376 ecr 87272183], length 0
13:36:29.934115 d8:24:bd:91:5d:40 > 50:5b:c2:5b:84:49, ethertype IPv4 (0x0800), length 1514: 52.40.111.108.443 > 172.31.12.136.32878: Flags [.], seq 1449:2897, ack 211, win 119, options [nop,nop,TS val 87272183 ecr 3277562063], length 1448
13:36:29.934153 50:5b:c2:5b:84:49 > d8:24:bd:91:5d:40, ethertype IPv4 (0x0800), length 66: 172.31.12.136.32878 > 52.40.111.108.443: Flags [.], ack 2897, win 274, options [nop,nop,TS val 3277562377 ecr 87272183], length 0
13:36:29.934188 d8:24:bd:91:5d:40 > 50:5b:c2:5b:84:49, ethertype IPv4 (0x0800), length 750: 52.40.111.108.443 > 172.31.12.136.32878: Flags [P.], seq 2897:3581, ack 211, win 119, options [nop,nop,TS val 87272183 ecr 3277562063], length 684
13:36:29.934222 50:5b:c2:5b:84:49 > d8:24:bd:91:5d:40, ethertype IPv4 (0x0800), length 66: 172.31.12.136.32878 > 52.40.111.108.443: Flags [.], ack 3581, win 296, options [nop,nop,TS val 3277562377 ecr 87272183], length 0
13:36:29.939527 d8:24:bd:91:5d:40 > 50:5b:c2:5b:84:49, ethertype IPv4 (0x0800), length 66: 52.40.111.108.443 > 172.31.12.136.32880: Flags [.], ack 211, win 119, options [nop,nop,TS val 87272183 ecr 3277562064], length 0
13:36:29.943859 d8:24:bd:91:5d:40 > 50:5b:c2:5b:84:49, ethertype IPv4 (0x0800), length 1514: 52.40.111.108.443 > 172.31.12.136.32880: Flags [.], seq 1:1449, ack 211, win 119, options [nop,nop,TS val 87272183 ecr 3277562064], length 1448
13:36:29.943934 50:5b:c2:5b:84:49 > d8:24:bd:91:5d:40, ethertype IPv4 (0x0800), length 66: 172.31.12.136.32880 > 52.40.111.108.443: Flags [.], ack 1449, win 251, options [nop,nop,TS val 3277562386 ecr 87272183], length 0
13:36:29.943995 d8:24:bd:91:5d:40 > 50:5b:c2:5b:84:49, ethertype IPv4 (0x0800), length 1514: 52.40.111.108.443 > 172.31.12.136.32880: Flags [.], seq 1449:2897, ack 211, win 119, options [nop,nop,TS val 87272183 ecr 3277562064], length 1448
13:36:29.944030 50:5b:c2:5b:84:49 > d8:24:bd:91:5d:40, ethertype IPv4 (0x0800), length 66: 172.31.12.136.32880 > 52.40.111.108.443: Flags [.], ack 2897, win 274, options [nop,nop,TS val 3277562386 ecr 87272183], length 0
13:36:29.944063 d8:24:bd:91:5d:40 > 50:5b:c2:5b:84:49, ethertype IPv4 (0x0800), length 750: 52.40.111.108.443 > 172.31.12.136.32880: Flags [P.], seq 2897:3581, ack 211, win 119, options [nop,nop,TS val 87272183 ecr 3277562064], length 684
13:36:29.944089 50:5b:c2:5b:84:49 > d8:24:bd:91:5d:40, ethertype IPv4 (0x0800), length 66: 172.31.12.136.32880 > 52.40.111.108.443: Flags [.], ack 3581, win 296, options [nop,nop,TS val 3277562387 ecr 87272183], length 0
13:36:29.948228 50:5b:c2:5b:84:49 > d8:24:bd:91:5d:40, ethertype IPv4 (0x0800), length 192: 172.31.12.136.32878 > 52.40.111.108.443: Flags [P.], seq 211:337, ack 3581, win 296, options [nop,nop,TS val 3277562391 ecr 87272183], length 126
13:36:29.948523 50:5b:c2:5b:84:49 > d8:24:bd:91:5d:40, ethertype IPv4 (0x0800), length 516: 172.31.12.136.33680 > 117.18.237.29.80: Flags [P.], seq 451:901, ack 789, win 253, options [nop,nop,TS val 1922912349 ecr 256664844], length 450: HTTP: POST / HTTP/1.1
13:36:29.950453 d8:24:bd:91:5d:40 > 50:5b:c2:5b:84:49, ethertype IPv4 (0x0800), length 66: 117.18.237.29.80 > 172.31.12.136.33680: Flags [.], ack 901, win 4288, options [nop,nop,TS val 256665025 ecr 1922912349], length 0
13:36:29.959036 50:5b:c2:5b:84:49 > d8:24:bd:91:5d:40, ethertype IPv4 (0x0800), length 192: 172.31.12.136.32880 > 52.40.111.108.443: Flags [P.], seq 211:337, ack 3581, win 296, options [nop,nop,TS val 3277562401 ecr 87272183], length 126
13:36:29.959310 50:5b:c2:5b:84:49 > d8:24:bd:91:5d:40, ethertype IPv4 (0x0800), length 516: 172.31.12.136.33690 > 117.18.237.29.80: Flags [P.], seq 451:901, ack 789, win 241, options [nop,nop,TS val 1922912360 ecr 256664849], length 450: HTTP: POST / HTTP/1.1
13:36:29.961784 d8:24:bd:91:5d:40 > 50:5b:c2:5b:84:49, ethertype IPv4 (0x0800), length 66: 117.18.237.29.80 > 172.31.12.136.33690: Flags [.], ack 901, win 3752, options [nop,nop,TS val 256665026 ecr 1922912360], length 0
13:36:30.020440 d8:24:bd:91:5d:40 > 50:5b:c2:5b:84:49, ethertype IPv4 (0x0800), length 854: 117.18.237.29.80 > 172.31.12.136.33680: Flags [P.], seq 789:1577, ack 901, win 4288, options [nop,nop,TS val 256665032 ecr 1922912349], length 788: HTTP: HTTP/1.1 200 OK
13:36:30.020516 50:5b:c2:5b:84:49 > d8:24:bd:91:5d:40, ethertype IPv4 (0x0800), length 66: 172.31.12.136.33680 > 117.18.237.29.80: Flags [.], ack 1577, win 266, options [nop,nop,TS val 1922912421 ecr 256665032], length 0
13:36:30.026218 50:5b:c2:5b:84:49 > d8:24:bd:91:5d:40, ethertype IPv4 (0x0800), length 516: 172.31.12.136.33680 > 117.18.237.29.80: Flags [P.], seq 901:1351, ack 1577, win 266, options [nop,nop,TS val 1922912427 ecr 256665032], length 450: HTTP: POST / HTTP/1.1
13:36:30.029744 d8:24:bd:91:5d:40 > 50:5b:c2:5b:84:49, ethertype IPv4 (0x0800), length 66: 117.18.237.29.80 > 172.31.12.136.33680: Flags [.], ack 1351, win 4824, options [nop,nop,TS val 256665033 ecr 1922912427], length 0
